Question,Answer1,Answer2,Answer3,Answer4,Correct
सबैभन्दा गहिरो नदी कुन हो ?,Bagmati,Karnali,Arun,Narayani,
तराई प्रदेशमा कति ओटा जिल्लाहरु पर्दछ ?,20,25,15,39,
How many districts are there in eastern development region of Nepal?,15,16,17,14,
Mid-Western Development Region मा कति ओटा अञ्चल छन् ?,4,2,5,3,
Mid-Western Development Region मा कति ओटा जिल्ला हरु छन् ?,18,14,15,16,
Which is the Highest Mountain of Africa?,Kilimanjaro,Mount Kenya,Mt Baker,Mt Stanley,
"""गौरीफान्टा नाका"" नेपालको कुन जिल्लामा पर्दछ ?",Kailali,Kanchanpur,Bajura,Rolpa,
कुन ग्रहमा वायुमण्डल छैन ?,Venus,Jupiter,Mercury,Uranus,
मंगल ग्रहमा कती ओटा उप-ग्रह हरु छन् ?,1,3,0,2,
पृथ्वी बाट सबै भन्दा नजिक रहेको तारा कुन हो ?,Venus,Mercury,Sun,Mars,
नेपालगन्ज -सुर्खेत मार्गलाई के भनिन्छ ?,Prithvi highway,Ratna highway,Amarsingh highway,Bp highway,
"कुन महादेश लाई ""हिम चादर""(ice sheet) उपन|मले चिनिन्छ ?",Antarctica,North America,Europe,North Asia,
Which is the Capital of Cambodia?,Brazzaville,Ottawa,Djibouti,Phnom Penh,
Far Western Development Region मा कति ओटा अञ्चलहरु छन् ?,3,5,2,4,
Myagdi जिल्लाको सदरमुकाम कुन हो ?,Beni,Kusma,Jomsom,Baglung,
How many districts are there in Sagarmatha Zone?,6,4,8,5,
Gulmi जिल्लाको सदरमुकाम कुन हो ?,Tansen,Tamghas,Sandhikharka,Parasi,
संसारकै सबै भन्दा ठुलो मन्दिर कुन हो ?,Temple of Saint Sava (Serbia),Birla Mandir (India),Angkor Wat Temple (Cambodia),Akshardham Temple (India),
सगरमाथालाई अर्को के नामले चिनिन्छ ?,पहिलो ध्रुव,दोस्रो ध्रुव,चौथो ध्रुव,तेस्रो ध्रुव,
सबै भन्दा गहिरो महासागर कुन हो ?,प्रशान्त,सुमेरु,कुमेरु,हिन्द,
सबैभन्दा कम श्लोक भएको पुराण कुन हो ?,वामन पुराण,गरुड पुराण,मार्कण्डेय पुराण,अग्नि पुराण,
बोधिसत्व अवतार मानिने लिच्छवि राजा को हुन ?,Amshuverma,Kamdev,Shivadev,Mandev,
बहादुर शाहले पस्चिम किल्ला कागड़ासम्मको रक्षाथ कसलाई जिम्मा दिएका थिए ?,भिमसेन थापा,चन्द्र सम्सेर,कालु पाण्डे,अमरसिह थापा,
'सी' बर्गका राणाहरुलाई उपत्यका बाहिर निस्कासन गर्ने राणा प्रधानमन्त्री को हुन् ?,Chandra samser,Vim samser,Dev samser,Juddha samser,
इस्ट टिमोर कुन महादेशमा पर्दछ ?,Africa,Europe,America,Asia,
मोटर चड्ने पहिलो राणा प्रधानमन्त्री को हुन् ?,Bir Shumsher,Dev Shumsher,Juddha Shumsher,Chandra Shumsher,
चन्द्र प्रभावतीका कति सन्तान थिए ?,३,४,उनी नि:सन्तान थिइन,५,
आफ्नो पनाति राजगद्धी मा बसेको देखने राजा को हुन् ?,King Tribhuwan,King Rajendra,King Surendra,King Pirthivi Bir Bikram,
यान्त्रिक क्रान्तिको परिणाम स्वरूप कुन शक्तिको आविस्कार भयो ?,आणविक,सबै उत्तर ठिक छन्,वाफ,जलस्रोत,
नेपालमा कति किसिमका लोक बाजाहरु छन् ?,५०० किसिमका,२५० किसिमका,२०० किसिमका,१५० किसिमका,
"आफ्ना भाई , छोराहरुका लागि उमेरको जेस्ठताका आधारमा रोलक्रममा प्रधानमन्त्री हुने परम्परा कसले बासालेका थिए ?",चन्द्र सम्सेर,जंगबहादुर,पदम सम्सेर,बिर सम्सेर,
भक्तपुरका अन्तिम राजा को थिए ?,रणजीत मल्ल,रत्न मल्ल,श्री निवाश मल्ल,भूपतिन्द्र मल्ल,
रोम साम्राज्य का निर्माता को थिए?,पिटर अलेवार्ड,नेमकुल,सोलोमोन,जुलिएस सिजर,
२०७० सालको नोना कोइराला स्मृति राष्ट्रिय पत्रकारिता पुरस्कार कसलाई प्रदान गरियो ?,Biram Bhattarai,Hari Bhattarai,Bikram Niraula,Rajendra Pandey,
From which country started Newspaper?,Japan,China,India,Thiland,
दुरबिन को प्रयोग गर्ने प्रथम नेपाली राजा को हुन् ?,Surendra Shah,Pratap Malla,Jay Prakash Malla,Pirthivi Narayan Shah,
Who is the writer of the book Let's Visit Nepal?,Tony Hegon,FD Hemilton,Aung San Suu Kyi,Daniel Wright,
राजा जनकको उपदेश कुन सभ्यताको आधारको रुपमा लिईन्छ ?,सिन्धुघाँटी,मानव,मिश्र,हिन्दु,
कुन राजा को पालामा बेलायतमा रक्तहीन क्रान्ति भएको थियो?,Charles II,Charles V,Charles VII,William III,
"नेपाल , भारत  र बेलायत बीच त्रिपक्षीय समझौता कहिले भएको थियो?",सन् १९६० सेप्तेम्बेर ११,सन् १९५०  अगष्ट १,सन् १९५४ अप्रिल २५,सन् १९४७ नेवेम्बेर ९,
एउटा गाविसमा कति वडा हुन्छन ?,१३,७,९,११,
राजनैतिक दलले कम्तिमा कति वर्षमा दलका पदाधीकारीहरुको निर्वाचन गर्नुपर्दछ ?,५,६,७,४,
नेपाल अधिराज्यको संविधान २०४७ कहिले घोषणा गरिएको थियो ?,2048/7/23,2047/03/03,2047/7/23,2047/8/28,
कार्ल मार्क्सको मिर्तु कहाँ भएको थियो ?,बेलायत,अमेरिका,जर्मनी,जापान,
लमजुंगका अन्तिम राजा कसलाई मानिन्छ ?,रणबहादुर शाह,दिव्य शाह,धर्म शाह,वीरमदन शाह,
राणाकालमा पहाडमा प्रत्येक थुमको प्रशासन हेर्न को रहेन व्यवस्था थियो ?,खरिदार,उमराब,सुब्बा,अमाली,
टंकप्रसाद आचार्य कहिले नेपालको प्रधानमन्त्री भए ?,२०१२ माघ ११,२०१२ माघ १५,२०१५ माघ २०,२०१२ माघ १३,
नेपाल बारुदी सुरुङ्ग मुक्त क्षेत्र (Landmine Field Free Country) घोषणा हुँदा नेपालका प्रधानमन्त्री को थिए ?,Girija Prasad Koirala,Baburam Bhattarai,Jhalanath Khanal,Madhav Kumar Nepal,
महिला माथि दुरब्वोहार गरेको आरोपमा राजीनामा दिने कृषि मन्त्री को हुन् ?,हरि पराजुली,हरि कार्की,गोबिन्‍द पराजुली,राधेश्याम कार्की,
अरस्तुले आफ्नो प्रसिद्ध ग्रन्थ The Politics के को बर्णन गरेका छन् ?,प्रजातन्त्र,सरकार र संसद,गणतन्त्र,सरकार र संबिधान,
राजतन्त्र भएको एकमात्र सार्क राष्ट्र कुन हो ? (Data of 2014),Bhutan,Maldives,Afganisthan,India,
"""Democracy is to the people,by the people and for the people"" यो कसको भनाइ हो ?",Carl marx,राजा बिरेन्द्र,Abraham Lincoln,महात्मा गान्धी,
नेपालमा सर्वप्रथम लोक सेवा आयोग को गठन कहिले भएको हो ?,२००५,२००८,२००६,२००४,
कालापत्थरमा कहिले मन्त्रीपरिषद्को बैठक बसेको थियो ?,2066 Bhadra 20,2066 Magh 15,2066 Mangshir 19,2066 Falgun 25,
लिछ्बिकालमा प्रहरी प्रमुखलाई के भनिन्थ्यो ?,भटनायक,धर्माधीकार,दण्डनायक,मुलनायक,
श्री ५ महाराजधिराज लाई ३१ तोप र श्री ५ युवराजधिराज लाई २१ तोपको सलामी दिने चलन कसले चलाएका हुन् ?,Chandra Samsher,Bhim Samsher,Juddha Samsher,Bir Samsher,
बढि महिला सैनिक भएको देशः,China,Russia,Israel,USA,
अन्चालाधिस पदलाई कहिले संवैधानिक बनाइएको थियो ?,२०२३,२०३५,२०३२,२०१८,
नेपालमा सर्बप्रथम रोप-वे निर्माण गराउने को हुन् ?,Dev Shamsher,Chandra Shamsher,Mohan Shamsher,Padma Shamsher,
नेपालका सार्वप्रथम महिला उपसभामुख को हुन् ?,लिला श्रेष्ठ(सुब्बा),सैलाजा आचार्य,नायक देवी,ओनसरी घर्ती,
विशव व्यापार संगठनको पहिलो मन्त्रिस्त्रिय बैठक कहाँ भएको थियो ?,वसिङटन डी.सी,जेनेभा,जापान,सिंगापुर,
हाल नेपालमा कति वटा औधोगीक रहेका छन् ?,२१,१५,२०,११,
नेपालले कस्तो अर्थव्यवस्थालाई अंगालेको छ ?,पुजिवादी अर्थव्यवस्था,साम्यवादी अर्थव्यवस्था,मिश्रीत अर्थव्यवस्था,कुनै पनि होइन,
ATM कार्ड प्रयोगमा ल्याउँने नेपालको पहिलो बैँक कुन हो ?,Standard Charted Bank,Nabil Bank,Everest Bank,Himalayan Bank,
सबै भन्दा ठुलो अन्तराष्ट्रिय बित्तिय संस्था कुन हो ?,Asian Development Bank,European Bank,World Bank,International Monetary Fund,
White Dollar भन्नाले के बुझिन्छ ?,वन्य जन्तु निर्यात गरेर कमाएको बिदेशी मुद्रा,सुन तथा अन्य धातु निर्यात गरेर कमाएको बिदेशी मुद्रा,वन जंगल बेचेर कमाएको बिदेशी मुद्रा,जल बिद्युत वा पानी निर्यात गरेर कमाएको बिदेशी मुद्रा,
बेलायतमा निजीकरण गरिएको पहिलो सस्थान कुन हो ?,ब्रिटिस पेट्रोलीयम निगम,स्टिल कम्पनी,टेलीकम्युनिकेसन,माथिका सबै,
नेपालको निर्यात व्यापार मा कुन क्षेत्रको योगदान प्रमुख रहेको छ ?,कृषि,गैर कृषि,काठ,जडिबुटी,
आर्थिक प्रहरी भन्नाले कसलाई जनाउछ?,अर्थ मन्त्री,लेखापाल,गवर्नर,लेखापरिक्षक,
नेपाल र भारत बिच बिप्पा (BIPPA) सम्झौता गर्ने नेपालका प्रधानमन्त्री को हुन् ?,Pushpa Kamal Dahal,Baburam Bhattarai,Jhalanath Khanal,Madhav Kumar Nepal,
Birgunj भन्सार भारतको कुन सहर संग जोडिएको छ ?,Amrtisar,Lucknow,Calcutta,Raxaul,
दशौ योजना अनुसार आयोजना कार्यक्रमहरु कतिओटा आधारमा प्राथमिकीकरण गरिएका थिए ?,6,7,5,8,
"BRICS मा पाँच राष्ट्र छन्। १ Brazil, २ Russia, ३ India, ४ China र पाँचौ राष्ट्र कुन हो ?",Serbia,Spain,Sweden,South Africa,
काठमाडौँ महा नगरपालिकाले फोहर बेव्स्थापन गर्न बर्सेनि कति रकम खर्च गर्छ ? (Data 2014 AD),20 करोड,25 करोड,40 करोड,30 करोड,
"माथिल्लो Marsyangdi ""A"" Hydro Power Project गण्डकी अंचल को कुन जिल्ला मा निर्माण भइरहेको छ ?",मकवानपुर,पर्वत,तनहु,लम्जुंङ,
प्रथम योजनामा सबैभन्दा बडी रकम कुन क्षेत्रमा विनियोजन गरिएको थियो ?,सुरक्ष,यातायात तथा संचार,Education,Agriculture,
कर्मचारी सञ्चय कोषको स्थापना कहिले भएको हो ?,वि.स. २०१९,वि.स. २००४,वि.स. २०२०,वि.स. २०१५,
नेपाल सरकार र भारत सरकार बीच पारबहन सन्धि सात बर्षका लागी कहिले नविकरण गरिएको हो ?,सन २००६ January‎ १२,सन २००६ January‎ ५,सन २००६ January‎ ६,सन २००६ January‎ ९,
राष्ट्रिय कृषि गणना २०६८ को प्रतिवेदन अनुसार पछिल्लो १० वर्षमा सुँगुर - बंगुर पालन ३० प्रतिसतले बढेको छ भने भेडा पालन कति प्रतिसतले बढेको छ ?,19 %,23 %,33%,29 %,
Who introduced the plan of Pension for the 1st time in Nepal?,Padma Shumsher,Juddha Shumsher,Mohan Shumsher,Bir Shumsher,
"प्रकाशको गति पत्ता लगाउने"" Scientist"" को हुन् ?",Dalton,Edward Jenner,Malthus,Romer,
भ्यागुते रोग विरुद्ध कुन खोप दिईइन्छ ?,DPT,TT,BCG,Polio,
नेपालमा कुन दिन जैविक विविधता दिवस मनाइन्छ?,१० December,२५ December,२९ December,१ December,
सबै भन्दा धेरै Uranium उत्पादन गर्ने देश कुन हो ?,Canada,Russia,Iran,China,
Bardiya राष्ट्रिय निकुञ्जको क्षेत्रफल कति रहेको छ ?,968 Sq. KM,918 Sq. KM,928 Sq. KM,998 Sq. KM,
Parsa वन्यजन्तु आराक्ष्य क्षेत्रको क्षेत्रफल कति रहेको छ ?,599 Sq. KM,415 Sq. KM,466 Sq. KM,499 Sq. KM,
भ्यागुते रोग कुन किटाणुबाट सर्दछ ?,कर्नोब्यकटेरियम डिप्थेसिया,भिब्रिओं,भईरस,मईको ब्यकटेरियम,
Shivapuri National Park को स्थापना कहिले भएको हो ?,BS 2065,BS 2057,BS 2060,BS 2058,
न्युरोन कति प्रकारको हुन्छन ?,५ प्रकारको,२  प्रकारको,४  प्रकारको,३  प्रकारको,
एड्स रोगको उत्पती सर्वप्रथम कुन देशमा भएको हो ?,अफ्रिका,रुस,अमेरिका,फ्रान्स,
Roger Federer is related with which game?,Tennis,Cricket,Swimming,Volleyball,
ASEAN  मा पाकिस्तान कहिले प्रवेश गरेको थियो ?,सन् २००३ जूलाई,सन् २००२ जूलाई,सन् २००४ जूलाई,सन् २००५  जूलाई,
0 and 1 Number System is Called?,Hexa,Decimal,Binary,Octa,
हावामा Oxygen को मात्रा कति प्रतीसत हुन्छ ?,21 %,23 %,27 %,25 %,
माल्दिव्सको  सरकारी  विमान सेवालाई के भनिन्छ ?,BIMAN,EIAI,Maldives International airways,PATNAM,
नेपालको निशाना छापमा कतिवटा लालिगुराँस छन् ?,14,10,8,5,
दुव्यसनका स्वोरुपमा देहायको कुन पर्दछ ?,लागु औषादको सेवन,तास जुवा,धुमपान तथा मध्यपान,माथिका सबै,
चितवन राष्ट्रिय निकुञ्जको क्षेत्रफल कति रहेको छ ?,932 Sq. KM,928 Sq. KM,938 Sq. KM,948 Sq. KM,
Lance Armstrong is related to?,Cycling,Cricket,Football,Tennis,
Lindsey Vonn of USA is related with which game?,Tennis,Beach Volleyball,Ski Race,Swimming,
पहिलो मिस नेपाल को हुनुहुन्छ ?,रुवी राणा,करिस्मा मानन्धर,नम्रता श्रेष्ठ,भुबना के सी,
हाल सम्म नेपाल सग दौत्य समन्ध कायम भएका राष्ट्र कति पुगेको छ?,१७०,१६८,१६७,१६५,
"ऐतिहासिक Boxing  खेल ""The Rumble in the Jungle "" मा  मुहम्मद अलि का प्रतिस्पर्धी को थिए ?",GEORGE FOREMAN,PURR,ZAIRE,ROPES,
बैंक अफ दी एयर - २०१९ कुन बैंक हो ?,ग्लोबल IME बैंक नेपाल लिमिटेड,मेगा बैंक नेपाल लिमिटेड,Standard Charter बैंक नेपाल लिमिटेड,NMB बैंक नेपाल लिमिटेड,
सार्कले कहिले देखि साकृतिक विविधताको संरक्षण गर्न कुनै एक महत्वपूर्ण सास्कृतिक धरोहरलाइ सास्कृतिक राजधानी घोषणा गर्न थाल्यो??,सन 2014,सन 2015,सन 2016,सन 2013,
नेपाल मा हाल कति स्थानीय तह रहेका छन?,755,752,754,753,
पहिलो पटक Internet Banking प्रयोगमा ल्याउने बैंक कुन हो ?,नबिल बैंक,हिमालयन बैंक,नेपाल बैंक लिमिटेड,कुमारी बैंक,
चिनियाँ विदेशमन्त्री वाङ यी तीनदिने भ्रमणका लागि कहिले  नेपाल आएका थिए?,२०७६ भाद्र २१,२०७६ भाद्र २३,२०७६ भाद्र २२,२०७६ भाद्र २४,
‘माड्साब’ उपनामले चिनिने नेपाली साहित्यकार को हुन् ?,डा अभि सुबेदी,बि पी कोइराला,डा हर्क गुरुङ,मदनमणि दीक्षित,
कहिले देखि महिला ले आधुनिक ओलम्पिक खेल  मा सहभागिता जनाउदै आएका हुन्?,सन् १८९९,सन् १९०४,सन् १९००,सन् १८९४,
विश्वभर सञ्चालित ‘जिरो हंगर च्यालेन्ज अभियान’ लाई आत्मसात् गर्दै नेपालले कहिलेसम्मा भोकमरी अन्त्य गर्ने प्रतिबद्धता जनाएको छ ?,सन् २०२१,सन् २०२३,सन् २०२५,सन् २०२२,
सन् २०१७ जूनमा सम्पन्न आठौं आईसीसी च्याम्पियन्स ट्रफी क्रिकेट प्रतियोगिताको उपाधि कसले जित्यो ?,इङ्ल्यान्ड,भारत,पाकिस्तान,ऑस्ट्रिलिया,
६ महिना मा विश्व को ८००० मिटर भन्दा १४ वोटा हिमाल आरोहन गरि किर्तिमान राख्न सफल पर्वतारोही को हुन् ?,लाक्पा शेर्पा,"दावा शेर्पा ,",मिग्मा शेर्पा,निर्मल पुर्जा,
आर्थिक सर्वेक्षण २०७३/७४ अनुसार आ.व. २०७३/७४ मा नेपालमा कति खाद्यान्न उत्पादन हुने अनुमान छ ?,९७ लाख १४ हजार टन,९७ लाख ४१ हजार टन,९४ लाख १ हजार टन,९७ लाख ७१ हजार टन,
१३औ सग गमे- २०१९(काठमाडौँ -पोखरा) कति स्वर्ण पदक  वितरण गरिने भएको छ ?,३१६,३१५,३१८,३१७,
सन २०१६ मा युरोकप प्रतियोगिता कुन देशमा आयोजना भएको थियो??,फ्रान्स,पोर्तुगल,स्पेन,जर्मनी,
सरकारले नेपालको पहिलो नर्सका रुपमा कसलाई घोषणा गर्यो ?,संजु अमात्य,माया,योजना,लामु अमात्य,
जलवायु परिवर्तनसम्बन्धी राष्ट्रसंघीय सम्मेलन (कोप-२५) -कोप २०१९ कहाँ हुदैछ?,"रियो- दि जेनेरियो ,ब्राजिल","कोपन्हेगन,डेनमार्क","म्याड्रिड,स्पेन","पेरिस ,फ्रान्स",
बाघ गणना 2075 अनुसार हाल नेपालमा बाघको संख्या कति रहेको छ?,135 वटा,235 वटा,234 वटा,195 वटा,
नेपाल मा कतिवटा स्थानीय तह रहेका छन् ?,७५१,७५२,७५३,७५०,
ABBCCCDDDD......को 50 औ अक्षर के आउछ??,M,J,K,I,
"On selling 17 balls at Rs. 720, there is a loss equal to the cost price of 5 balls. The cost price of a ball is",55,50,60,45,
"दिईएको सेरिज पुरा गर्नुस..!! 8,6,9,23,87,??",6x2=12-3=9,8x1=8-2=6,87x5=435-6=429,9x3=27-4=23,
"एउटा समारोहमा सहभागीले हात मिलाउदा जम्मा 1326 पटक मिलाएछन,भने जम्मा कति जना सहभागी थिए??",52 जना,42 जना,62 जना,72 जना,
