Question,Answer1,Answer2,Answer3,Answer4,Correct
"४००० दर्शक अटाउने क्षमता भएको ""ANFA Complex "" कुन देशको सहयोग मा निर्माण भएको हो?",America,FIFA's Goal Project,Japan,Japan,
हाल सम्म नेपाल सग हवाई सम्झौता भएका राष्ट्र कति पुगेको छ?,४१,४०,३८,३९,
"""खोलौ बैंक खाता राष्ट्रिय अभियान"" को सुरुवात देखि भएको हो?",बि स  २०७६  बैशाख १६,बि स  २०७५ बैशाख २,बि स  २०७६  जेष्ठ १,बि स  २०७६  बैशाख १,
भारतले हालै नयाँ राजनीतिक नक्सा कहिले प्रकाशित गरेको हो ?,२०१९ नोभेम्बर ५,सन् २०१९ नोभेम्बर २,सन् २०१९ नोभेम्बर ४ सन्,सन् २०१९ नोभेम्बर ३,
संयुक्त राष्ट्र संघ शान्ति स्थापना गर्न सबैभन्दा बढी खर्च गरेको मुलुक कुन हो?,लेबनाल,कम्बोडिया,बुरुण्डी,हाइटी,
सहि उतर छान्नुहोस् १ प्रधान कार्यालय द हेग सहरमा रहेको अन्तराष्ट्रिय न्यायालय मा 9  जना न्यायधिश रहने व्यवस्था छ। २ नेपाल संयुक्त राष्ट्र संघ को आर्थिक तथा सामाजिक परिषद को २ पटक सदस्य भएको छ ? ३ नेपाल ले संयुक्त राष्ट्र संघ को सदस्यको लागि प्रथम पटक आबेदन दिंदा रसिया ले अस्विकार गरेको थियो।,सबै ठिक,३ मात्र ठिक,१ र २ मात्र ठिक,२ मात्र ठिक,
बिश्व फूटबल को सबैभन्द प्रतिष्ठित अवार्ड बालोन डी’ओर अवार्ड -२०१९  कसले जिते ?,भिर्गिल भान डायक,लियोनल मेस्सी,"क्रिस्टियानो रोनाल्डो,",साडियो माने,
"टेनिश खेल विमब्लेडन (Wimbledon) को उपाधि सबैभन्दा बढी ""लगातार"" जित्ने खेलाडी को हुन् ?",Pete Sampras,Roger Federer,William Renshaw,Novak Djokovic,
नेपाल मा कतिवटा गाउँ पालिका छन् ?,४६०,६४०,५६०,५४०,
लोयी Institute ले  २०१९ अनुसार संसार को सबैभन्दा बढी कुटनीतिक समन्ध स्थापित गर्ने देश कुन हो?,चिन,बेलायत,फ्रान्स,अमेरिका,
यस वर्ष (विसं २०७६) को चक्रपाणि स्मृति पुरस्कार कसलाई प्रदान गरियो ?,बालसाहित्यकार एवम् जीवनीकार गोपाल पराजुली,वैरागी काइँला,श्री दुर्गा बराल (वात्स्यायन),योगेशराज,
"नेपालको कुन जिल्ला मा ""सुकिलुम्बा विमानस्थल"" निर्माण हुदै छ ?",Nawalparasi,Jhapa,Chitwan,Illam,
प्रसिद्ध पर्यटकिय स्थल 'घान्द्रुक' कुन जिल्लामा पर्दछ ?,Kaski,Gorkha,Pyuthan,Lamjung,
Which is the smallest Zone in Nepal?,Bheri,Lumbini,Mahakali,Narayani,
नेपालको भुकम्प पिडित लाई उद्धार गर्न आएको कुन देश को सैनिक जहाज दुर्घटनामा परेको थियो ?,India,Israel,China,America,
Bheri अञ्चलको सदरमुकाम कुन हो ?,Dunai,Nepalgunj,Manma,Guleria,
Solukhumbu जिल्लाको सदरमुकाम कुन हो ?,Taulihawa,Beni,Salleri,Triyuga,
Central Development Region मा पर्ने अञ्चल कुन हो ?,Koshi,Mechi,Narayani,Rapti,
Lumbini अञ्चलमा कती ओटा जिल्लाहरु छन् ?,3,4,6,5,
उच्च हिमाल हरुको देश भनेर कुनलाई चिनिन्छ ?,Bhutan,Switzerland,Germany,Nepal,
"सात ओटा वडा को एकै गाउँ भएको गोर्खाको कुन गाउँ हो, जुन गाउँ गोर्खाको नमुना पर्यटकीय गाउँको रुपमा पनि चिनिन्छ ?",आबु खैरेनी,आरुघाट,बारपाक,मनकामना,
Far Western Development Region मा कति ओटा जिल्लाहरु छन् ?,15,9,16,14,
Which district has the highest no. of Airports in Nepal?,Okhaldhunga,Chitwan,Solukhumbu,Kathmandu,
त्रिशुलीको लम्बाई कति रहेको छ ?,350 km,263 km,470 km,550 km,
शनि ग्रहको सबै भन्दा ठुलो उपग्रहको नाम के हो ?,Lapetus,Mimas,Rhea,Titan,
Narayani अञ्चलको सदरमुकाम कुन हो ?,Gaur,Bharatpur,Kalaiya,Birgunj,
Dhading जिल्लाको सदरमुकाम कुन हो ?,Kathmandu,Malekhu,Dhadingbesi,Lalitpur,
झोलुङ्गे पुलको जिल्ला भनेर कुन जिल्लालाई चिनिन्छ ?,Baglung,Tanahu,Gorkha,Lamjung,
मेची अञ्चलको कुन जिल्लाले भारत र चीन दुवै छुन्छ ?,Illam,Taplejung,Jhapa,Panchthar,
पशुपतिनाथमा चादीका चार ढोका राख्न लगाउने प्रधानमन्त्री को हुन् ?,जुद्द सम्सेर,जंगबहादुर,चन्द्र सम्सेर,भीमसेन थापा,
चेस खेलको सुरु कुन देशबाट भएको हो ?,India,China,Nepal,USA,
रामले सीतालाई त्यागे पछि उनले कुन ऋषिको आश्रममा शरण लिएकी थिइन ?,आत्रेय,बिस्वामित्र,बाल्मिकी,Basistha,
भगवान Gautam Buddha ले कुन ठाउँ मा तपस्या गरेर ज्ञान प्राप्त गरेका थिए ?,भारतको गया,भारतको काशी,भारतको बनारस,लुम्बिनी,
अरस्तु (Aristotle) कसका चेला थिए ?,Jesus Christ,निकोमेसस,सुकरात (Socrates),प्लेटो (Plato),
पौगम्बर मोहमदको जन्म कहाँ भएको हो ?,Saudi Arabia,Qatar,UAE,Iran,
अंशुबर्मा कुन बंशका थिए ?,शाही,सोमवंशी,मल्ल,ठकुरी,
नरभूपाल शाहका कति  रानीहरु थिए ?,९,५,७,४,
भारतको Chennai मा हालै सम्पन 'मिस एसिया २०१५ 'प्रतियोगिताको उपाधी जितने युवती को हुन् ?,ग्रिष्मा बसनेत,दिपिका पदूकोंन,काजल अग्रवाल,कनिका कपूर,
लम्जुङ् र कास्की कसको नायबी कालमा एकीकृत नेपालमा मिलाइएको थियो ?,बहादुर थापा,सुबर्ण प्रभा,राजेन्द्र लक्ष्मी,ललित त्रिपुरा सुन्दरी,
योगी नरहरी नाथको बाल्यकालको नाम ___________ हो।,बिरबल सिँह थापा,बल बिर सिँह थापा,बिर सिँह थापा,बल बिर सिँह,
राजा त्रिभुवनको शुभराज्याभिसेक कहिले भएको  थियो ?,वि.स. १९६७,वि.स. १९६९,वि.स. १९६६,वि.स. १९६८,
गौरवमय क्रान्ति (Glorious Revolution) को समयमा बेलायत का राजा को थिए ?,Elbert I,Charles II,John,James II,
युवा कबि भनेर कसलाई चिनिन्छ ?,यज्ञराज  ढकाल,धर्मराज थापा,सिद्धिचरण श्रेष्ठ,मोतीराम भट्ट,
भानुभक्त आचार्यको हजुरबुवाको नाम श्रीकृष्ण आचार्य थियो भने बुवाको नाम के थियो ?,रामकृष्ण आचार्य,धर्मभक्त आचार्य,रामगोपाल आचार्य,धनन्जय आचार्य,
तपस्या गरी प्रण त्याग गर्ने विचारले अमरसीह थापा कतातिर लागे ?,गोसाईकुण्ड,देवघाट,देवीघाट,काठमाडौँ,
नेपालको पहिलो धार्मीक शहिद को हुन् ?,पं सुवर्ण सुवेदी,पं दिनबन्धु पोखरेल,पं नारायण प्र पोखरेल,मोहम्मद इस्तिफाक,
रंगोली बाट Morang जिल्लाको सदरमुकाम Biratnagar कहिले सारिएको हो ?,BS 1969,BS 1958,BS 1938,BS 1971,
' भट्टारक ' कसलाई भनिन्थ्यो ?,प्रधानसेनापती,प्रसासक,युबराज,राजा,
सरकारले वि.सं २०७१ मंसिर १६ गते कति नयाँ नगरपालिका घोषणा गरेको छ ?,15,47,57,61,
महात्मा गान्धीको अदर्स के थियो ?,"Democracy is to the people , by the people and for the people",Ahimsa and truth are two lungs,Knowledge is virtue and virtue is knowlegde,साधा जीवन उच्च विचार,
Who is the first lady Speaker of Nepal?,Onsari Gharti Magar,Hisila Yami,Sujata Koirala,Bidhya Devi Bhandari,
नेपालको गोर्खाली सैनिक र गडवालबिच कहिले सान्ति सम्झौता भएको थियो ?,सन् १७९०,सन् १७९१,सन् १९९२,सन् १९९३,
Who shifted Durbar High School from Narayanihiti and built the current building near Rani Pokhari and started the classes?,Bir Sumsher Ja.Ba.Ra.,Ranodip Singh Kunwar Rana,Dev Shumsher Ja.Ba.Ra.,Chandra Shumsher Ja.Ba.Ra.,
डा. शाम सास्त्री ले कौटिल्य को अर्थशास्त्र लाई कहिले Indian Antiquery नामक पत्रिकामा English मा Translate गरि प्रकासित गरेका थिए ?,1901 AD,1908 AD,1905 AD,1903 AD,
प्रधान न्यायाधिस बाट प्रधानमन्त्री हुने व्यक्ति को हुन् ?,Khilraj Regmi,Sher Bahadur Deuba,Surya Bahadur Thapa,Subash Nemwang,
पहिलो राणा प्रधानमन्त्री को हुन् ?,Mohan Shamsher Ja Ba Ra,Bir Shamsher Ja Ba Ra,Ranodip Singh Kunwar Rana,Jang Bahadur Rana,
व्यवस्थापिका संसद हुन कति वर्ष उमेर पुरा भएको हुनुपर्दछ ?,२२,२४,२६,२५,
तल दिएका मध्ये को नेपाली सेनाको चिफ होइन ?,Gaurav Shumsher Ja Ba Ra,Pyar Jung Thapa,Rookmangud Katawal,Kul Bahadur Khadka,
अरस्तुको रचनालाई Oxford University ले कति खण्डमा प्रकासित गरेको छ ?,१३ खण्ड,११ खण्ड,१० खण्ड,१२ खण्ड,
Abraham Lincoln जन्म अमेरिकाको कुन राज्य मा भएको थियो ?,Maryland,California,Kentucky,Texas,
अन्तर्राष्ट्रिय पर्वतारोहण उद्यान नुवाकोटको ककनीमा स्थापना गरिएको छ भने जैविक प्रयोगशाला कुन ठाउँमा रहेको छ ?,Nawalparasi,Lalitpur,Janakpur,Chitwan,
एसियाली विकास बैंकको कार्यालय कहाँ छ ?,वसिङटन डी.सी,बैंकक,मनिला,जेनेभा,
नेपाल सरकारले ट्रेजरी बिलको निस्कासन कहिले बाट गरेको थियो ?,BS 2018,BS 2022,BS 2021,BS 2020,
U.N.O को स्थापना कहिले भएको हो?,24 Jan. 1946,24 Oct. 1945,10 Oct. 1947,02 Jun. 1940,
कुनै पनि राष्ट्रको सरकार ले लिएको ऋणलाई के भनिन्छ ?,सार्बजनिक ऋण,बैदेसिक ऋण,सह-कार्य ऋण,सरकारी ऋण,
Deficit Financing (घाटा बजेट) कसको सिद्दान्त हो ?,Rosenstein Rodan,J. M. Keynes,Adam Smith,David Ricardo,
दशौ पन्च बर्षिय योजना कहिले देखि सुरु भएको हो ?,2059 BS,2060 BS,2057 BS,2058 BS,
सन् १९५१ मा नेपाललाई पहिलो पटक बैदेसिक सहायता दिने राष्ट्र कुन हो ?,China,United States of America,France,Japan,
"अर्थशास्त्रमा मुद्रा र ज्यालाको सम्बन्ध देखाउने एउटा प्रसिद्ध बक्ररेखा छ, त्यसलाई के भनिन्छ?",ज्याला बक्ररेखा,Peril Point,Phillips Curve,सिमान्त रेखा,
नेपालमा सर्वप्रथम कहिले देखि उद्योग स्थापना भएको पाइन्छ ?,वि.स.१९९५,वि.स.१९९२,वि.स.१९९४,वि.स.१९९३,
पर्यटन विकास बोडको अध्यक्षमा को रहन्छ ?,सचिब,कुनै पनि होइन,प्रधानमन्त्री,पर्यटन मन्त्रि /राज्यमन्त्री,
नौं सय मेगावाट क्षमताको अरुण तेस्रो जलविद्दुत आयोजना निर्माणका लागि भारतिय कम्पनी सतलज जलविद्दुत निगमसँग परियोजना विकास सम्झौता कहिले भएको थियो ?,2071 Mangshir 9,2071 Kartik 15,2070 Magh 8,2071 Baishak 8,
Bank of the Year 2014 is..........?,Global IME Bank,Nabil Bank,Nepal Investment Bank,Standard Charted Bank,
हाल नेपालमा कति प्रकारका ऋण पत्रहरु प्रयोगमा ल्याइएको छ ?,5 प्रकार,3 प्रकार,7 प्रकार,2 प्रकार,
Tied Loan भन्नाले के बुझिन्छ ?,ससर्त ऋण,घरायसी ऋण,कर्जा चुक्ता,ब्यबसायिक ऋण,
United Nations बाट सबै आप्रवासी कामदार तथा तिनीहरुको परिवारको सदस्यको अधिकार सम्बन्धि अन्तराष्ट्रिय महासन्धि कुन वर्ष को December 18 तारिख मा पारित भएको थियो ? त्यस पश्चात December 18 लाई अन्तराष्ट्रिय आप्रवासन दिवस मनाउन थालिएको हो ?,1985 AD,1995 AD,1990 AD,1992 AD,
Which National Park in Nepal receives the highest no. of Tourist?,Bardiya National Park,Sagarmatha National Park,Langtang National Park,Chitwan National Park,
Caroline Wozniacki is related with which Game?,Football,Tennis,Cricket,Volleyball,
Maria Sharapova खेल संग सम्बन्धित छिन् ?,Swimming,Table Tennis,Tennis,Womens Cricket,
अन्तराष्ट्रिय ओजोन तह संरक्षण दिवस कहिले मनाईन्छ ?,April 21,September 16,March 15,July 21,
James Hargreaves ले Spinning Jenny को आविस्कार कहिले गरेका थिए ?,1760 AD,1770 AD,1765 AD,1775 AD,
काठमाडौँ उपत्यका बाट दैनिक 650 Metric Ton फोहोर उत्पादन हुन्छ । यस मध्ये काठमाडौँ उपत्यका का अस्पताल बाट कति प्रतिसत फोहर निस्किन्छ ? (According to data of 2013 AD),20 %,15 %,12 %,10 %,
भेडामा नस्ल सुधारका उपाय पत्ता लगाउने बैज्ञानिक को हुन् ?,John Kay,रबर्टवेक बेल,James Hargreaves,George Stephenson,
सन् २०१४ को FIFA विश्वकप बिजेता कुन राष्ट्र भयो ?,Holland,Germany,Argentina,Brazil,
Galileo ले पता लगाएको ग्रह कुन हो ?,अरुण्ड,शुक्र,Biraspati,शनी,
विश्वमा सबैभन्दा बढि HIV सक्रमित भएको देश कुन हो ?,China,Brazil,Pakistan,India,
संसारकै सबै भन्दा छिटो उड्ने चरा कुन हो ?,Golden Eagle,Teal,Swift,Peregrine Falcon,
बच्चा कति उमेरको भएपछि दादुराविरुद्धको खोप दिईन्छ ?,९ महिना,७ महिना,८ महिना,१० महिना,
Motorcycle को अविस्कार कसले गरेको थियो ?,Gottliels Daimler,Clark,John J.Loud,John walker,
राष्ट्रिय गान नभएको देशः,China,Japan,Switzerland,Mexico,
१ लाख अमेरिकी डलरको SAARC Literary Award पाउने नेपाली साहित्यकार को हुन् ?,रबिन मास्के,सरोज अधिकारी,सुमन पोख्रेल,मन्जु थापा,
Law of Heredity का प्रतिपादक को हुन् ?,John peterson,Newton,John graear mandel,Maxwell,
World सम्पदा  दिवस कहिले मनाइन्छ ?,15 April,11 April,18 April,10 April,
How many bones are there invertbrate?,33,30,35,32,
नेपाल राष्ट्र बैंक को स्थापना कहिले भएको हो?,28 April 1956,26 April 1956,25 April 1956,27 April 1956,
विश्व मधुमेह दिवस कहिले मनाइन्छ ?,जनवरी २६,नोभेम्बर १४,मार्च २४,अप्रिल ७,
नागढुङ्गा–नौबिसे सुरुङमार्गको शिलान्यास कहिले गरिएको हो ?,विसं २०७६ कात्तिक १,विसं २०७६ कात्तिक ३,विसं २०७६ कात्तिक ४,विसं २०७६ कात्तिक २,
नेपालमा सन् २०३० सम्ममा कुपोषणको दर कति प्रतिशतमा झार्ने लक्ष्य लिइएको छ ?,१५ प्रतिशत,१६ प्रतिशत,१७ प्रतिशत,१४ प्रतिशत,
अमेरिकाका पहिलो राष्ट्रपति जर्ज वासिङ्टन  ले आफ्ना सैनिक संग खेलेको खेल कुन हो?,Chess,Football,Rounder/Baseball,Cricket,
अन्तराष्ट्रिय  फौजदारी अदालत को सदस्यता त्याग्ने राष्ट्र कुन को ?,इजरयल,बुरुण्डी,कंगो,ताइवान,
प्यासिफिक एसिया ट्राभल एसोसिएसन (पाटा) द्वारा सन् २०१९ अक्टोबरमा सार्वजनिक तथ्याङ्कअनुसार पर्यटक वृद्धिदरमा एसिया प्रशान्त क्षेत्रमा पहिलो स्थानमा रहन सफल राष्ट्र कुन हो ?,भारत,चीन,पाकिस्थान,नेपाल,
नेपाल संयुक्त राष्ट्र संघ को आर्थिक तथा सामाजिक परिषद को कति पटक सदस्य भएको छ ?,२ पटक,१ पटक,४ पटक,३ पटक,
विक्रम संवत् २०७६ असोज २८–३० सम्म काठमाडौँमा आयोजित गैरआवासीय नेपाली सङ्घ (एनआरएनए) को अध्यक्षमा चयन हुन सफल व्यक्तित्व को हुन् ?,कुमार पन्त,शेख घले,भबन  भट्ट,उपेन्द्र महतो,
काठमाडौँ उपत्यकामा विद्युतीय बस सेवाको सुरुवात कहिलेदेखि गरिएको हो ?,विसं २०७६ भदौ २२,विसं २०७६ भदौ २३,विसं २०७६ भदौ २५,विसं २०७६ भदौ २४,
१. जङ्गली हात्ती भगाउनका लागि साइरन ड्रोन निर्माण गर्ने नेपाली प्रतिभा को हुन् ?,रञ्जन चौधरी,अनिल प्रधान,अनुप श्रेष्ठ,राम भण्डारी,
१३औ SAG GAME 2019 (काठमाडौँ -पोखरा) कहिले देखि सुरु भयो?,सन् २०१९ डेसेम्बेर १०,सन् २०१९ नोवेम्बेर  १,सन् २०१९ डेसेम्बेर १,सन् २०१९ डेसेम्बेर ५,
नेपालको सबभन्दा लामो नदी कुन हो ?,Karnali,Saptakoshi,Bhotekoshi,Narayani,
Europe महादेशको सबै भन्दा अग्लो हिमाल कुन हो ?,Mount Everest,Mount McKinley,Mount Elbrus,Mount Aconcagua,
अरुण ग्रहमा कति वटा उपग्रह छन् ?,19,25,26,24,
Dhankuta जिल्लाको सदरमुकाम कुन हो ?,Dhankuta,Inaruwa,Biratnagar,Bhojpur,
च्छो रोल्पा ताल कुन जिल्लामा छ ?,पर्बत,डोल्पा,रसुवा,दोलखा,
नेपालको प्रसिद्ध चिया बगान कहाँ छ ?,Taplejung,Panchthar,Jhapa,Illam,
Rupandehi जिल्लाको सदरमुकाम कुन हो ?,Sandhikharka,Bhairahawa,Bharatpur,Tansen,
नेपालभित्रको दुरीलाई हिसाब गर्दा कर्णाली नदि कति लामो छ ?,400 km,450 km,507 km,550 km,
सौय मण्डलमा सबैभन्दा चम्किलो ग्रह कुन हो ?,Venus,Earth,Marks,Mercury,
२०७३ चैतमा लिइएको माध्यामिक शिक्षा परीक्षा (एसईई)मा नियमिततर्फ कति विद्यार्थी उत्तीर्ण भए ?,चार लाख ४५ हजार ५६४,छ लाख ४५ हजार ५६४,पाच लाख ४५ हजार ५६४,तिन लाख ४५ हजार ५६४,
