Question,Answer1,Answer2,Answer3,Answer4,Correct
जनमत संग्रह गराउने घोसणा कहिले भएको थियो ?,२०३६ जेठ १०,२०३६ जेठ १५,२०३६ जेठ ११,२०३६ जेठ ०५,
गणतन्त्र नेपालका प्रथम रास्ट्रपति को हुन् ?,राम बरण यादव,ज्ञानेन्द्र शाह,परमानन्द झा,पुष्प कमल दाहाल,
नेपालको सार्वप्रथम महिला  न्यायाधीश को हुन् ?,लिला श्रेष्ठ,जयकला देवी,शारदा श्रेष्ठ,शुसीला थापा,
कुनै औद्योगिक संस्था वा कम्पनी प्रदत अंशदान वा शेयरका सट्टामा प्राप्त धन लाई के भनिन्छ ?,ब्याज,लाभांश,शेयर,नाफा,
Daniel Vettori is related with which sport?,Cricket,Hockey,Tennis,Football,
मुटुको गति नाप्ने यन्त्र लाई के भनिन्छ?,Barometer,Thermometer,Cardiogram,Stethoscope,
Rara राष्ट्रिय निकुञ्जको क्षेत्रफल कति रहेको छ ?,118 Sq. KM,106 Sq. KM,119 Sq. KM,110 Sq. KM,
How many districts are there in Bheri Zone?,4,5,6,8,
Far Western Development Region मा पर्ने अञ्चल कुन हो ?,Gandaki,Bheri,Narayani,Seti,
नदी नै नभएको सार्क राष्ट्र कुन हो?,Bhutan,Srilanka,Maldives,Nepal,
विश्वको सबै भन्दा अग्लो Tower कुन हो?,Ostankino Tower (Russia),Canton Tower (China),CN Tower (Canada),Tokyo Sky Tree (Japan),
Mohottari जिल्लाको सदरमुकाम कुन हो ?,Jaleshwor,Sindhulimadi,Manthali,Charikot,
Bagmati अञ्चलको सदरमुकाम कुन हो ?,Lalitpur,Kathmandu,Banepa,Bharatpur,
भिमसेन थापाको जन्म कहिले भएको थियो ?,वि.स. १८३३,वि.स. १८३१,वि.स. १८३२,वि.स. १८३५,
टिग्रिस र युक्रेटस नदिको किनारमा हुर्केको सभ्यतालाई के भनिन्छ?,चीनको सभ्यता,मिश्र सभ्यता,सिन्धुघाँटीको सभ्यता,मेसोपोटामिया सभ्यता,
द्रविङ् भाषा परिवार अन्तर्गत बोलिने भाषालाई के भनिन्छ ?,भांगड,अबदी,सतार,राजबंशी,
Which is the oldest temple of wood in nepal?,Chagunarayan,Pasupathinath,Kumari,Kasthamandap,
अंशुबर्माको कहिले देहवसान कहिले भयो ?,वि.स.६६८,वि.स.६७५,वि.स.६७८,वि.स.५६४,
कहिले पृथ्वीनारयण शाह गोर्खाका राजा भए ?,वि.स.१७९७,वि.स.१७९८,वि.स. १७९९,वि.स.१७९५,
"According to the official website of Government of Australia, among the 100 best Universities in the world, how many lies at Australia?",10 Universities,7 Universities,20 Universities,3 Universities,
अदुवा उत्पादनमा नेपाल बिश्वोको कुन स्थानमा पर्छ ?,3,4,2,5,
भगवान Gautam Buddha ले के को रुख मुनि ज्ञान प्राप्त गरेका थिए ?,स्वामी,वर,साल,पिपल,
How many districts were there in Nepal at the time of Bhimsen Thapa?,30,39,35,42,
World Bank ले हालै सार्बजनिक गरेको प्रतिबेदन अनुसार (2012 AD) मा कुल गार्हस्थ उत्पादन (GDP) को अनुपात मा सबै भन्दा धेरै रेमिटान्स (Remittance) भित्र्याउने मुलुक कुन हो?,Tajikistan,India,China,Nepal,
"फलामको मात्रा, चुन, Nitrogen, Phosphorus जस्ता खनिज तत्तो पनि कम हुने माटो कुन हो?",तलैया माटो,रातो फुस्रो माटो,हिमाली माटो,बलौटे पत्थरिलो माटो,
Jacques Kallis is related with.... ?,Football,Hockey,Tennis,Cricket,
तलका मध्ये कुन प्रजाती स्तनधारी होइन ?,साँस,सारस,हाब्रे,चरी बाघ,
ढोरपाटन सिकार आराक्ष्यमा कती प्रकारका जीवजन्तु पाइन्छ ?,18,10,15,20,
अस्ट्रेलियाको थिङ्क ट्याङ्क इन्स्टिच्युट फर इकोनोमिक्स एन्डपिस (आईईपी) द्वारा जारी विश्व शान्ति सूचकाङ्क २०१९ मा नेपाल कतिऔँ स्थानमा रहेको छ ?,७३ औँ,७६औँ,८७औँ,८४औँ,
विश्वको सबै भन्दा गहिरो ठाउँ कुन हो ?,South Sandwich Trench,Puerto Rico Trench,Java Trench,Mariana Trench,
कामिनी दह कुन जिल्लामा पर्दछ ?,मुगु,कास्की,चितवन,पर्सा,
क्षेत्रफ़लको हिसाबले तेस्रो ठुलो ग्रह कुन हो ?,बिर्सपति   अरुण,अरुण,मंगल,शनी,
८ हजार मिटर भन्दा अग्लो हिमाल नेपालमा कती ओटा छन् ?,8,7,9,10,
विश्वको प्रथम जलस्रोतको धनी देश कुन हो ?,Nepal,China,Brazil,Argentina,
"पृथ्वीमा कुन कुन दिन, दिन र रात बराबर हुन्छ ?",March 2 र September 2,March 11 र September 11,March 12 र September 18,March 21 र September 23,
श्री रामचन्द्रका भाई लक्ष्मणको श्रीमतीको नाम के हो ?,मेनका,राधा,सिता,उर्मिला,
थारु जातिद्वारा बडादशैंमा कृष्णको कथामा आधारित भै गरिने नाचगान के हो ?,माघी,चण्डी,घोराही,सखिया,
बेलायती सेनाको सर्बोच्च सम्मानलाई के भनिन्छ ?,AC,DC,CC,VC,
कहिले अंग्रेजले नेपाल विरुद्ध लडाईको घोसड़ा गरे ?,वि.स. १८१८,वि.स. १८१५,वि.स. १८१५,वि.स.१८१७,
बिश्व सम्पदा सुचिमा नपरेको स्थान कुन हो ?,बौद्धनाथ,जानकी मन्दिर,सोयम्बुनाथ,चाँगुनारायण,
भण्डारखाल पर्व हुदा नेपालका प्रधानमन्त्री को थिए ?,बिर सम्सेर,भीमसेन थापा,माथोर सिंह थापा,जंग बहादुर,
तल दिएका मध्ये को प्रहरी महानिरीक्षक होइनन् ?,Upendra Kata Aryal,Madan Khadka,DB Lama,Rabindra Pratap Shah,
कार्ल मार्क्सले कहिले दर्सन शास्त्रमा वीधावारिधी  उपाधि प्राप्त गरे ?,1466,1845,1841,1855,
अरस्तु ले सरकार र संबिधान लाई कति आधार मा बर्गिकरण गरेका छन् ?,2,3,5,4,
नेपाल राष्ट्र बैंकको स्थापना कहिले भएको हो ?,2017 Magh 15,2015 Poush 18,2013 Baishak 14,2011 Chaitra 28,
"""Purple Haze "" गाँजा विश्वको कुन एक मात्र ठाउँमा पाइने गरिन्छ?",कोलम्बिया,भुटान,ब्राजिल,नेपाल,
लिम्बु जातिले कुन पर्व मनाउदछन ?,फोदडमा,तिहार,घौला,फालो,
होग डिएर (Hog Deer) कुन वन्य जन्तु आरक्ष्यमा पाइन्छ ?,बर्दिया राष्ट्रिय निकुञ्ज,कोशी टप्पु,चितवन राष्ट्रिय निकुञ्ज,शुक्लाफाँट,
Computer मा Ctrl + A ले के काम गर्दछ ?,Cut All,Select All,Remove All,Copy All,
Palpa जिल्लाको सदरमुकाम कुन हो ?,Taulihawa,Tansen,Bhairahawa,Sandhikharka,
Banke जिल्लाको सदरमुकाम कुन हो ?,Nepalgunj,Dailekh,Birendranagar,Guleria,
Singapore के का लागी प्रसिद्ध छ ?,व्यापार,मनोरंजन,जुवा,सुन,
राप्ती अञ्चलमा नपर्ने जिल्ला कुन हो ?,Pyuthan,Rukum,Kalikot,Dang,
Darchula जिल्लाको सदरमुकाम कुन हो ?,Dadeldhura,Mahendranagar,Baitadi,Darchula,
तल दिएको मध्ये कुन ताल कास्की जिल्लामा पर्दैन ?,पाँच पोखरी,बेगनास ताल,फेवा ताल,रुपा ताल,
Kathmandu जिल्लाको सदरमुकाम कुन हो ?,Bharatpur,Patan,Kathmandu,Bhaktapur,
"""Man is born free but everywhere he is in chains"" यो भनाइ कसको हो ?",Voltaire,Russo,Aristotle,Montesquieu,
,प्रा डा. बासुदेव त्रीपाठी,प्रा डा. देवराज त्रीपाठी,प्रा डा. बासुराम त्रीपाठी,प्रा डा. गोबिन्द त्रीपाठी,
भगवान बुद्धको चित्र अंकित मुद्रा (सिक्का) प्रचलनमा ल्याउने राष्ट्र कुन हो ?,लाओस,सिंगापुर,थाईल्याण्ड,श्रीलंका,
नोबेल शान्ति पुरस्कारका  लागी महात्मा गान्धी पाँच चोटी मनोनयनमा परेका थिए भने Jawaharlal Nehru सो पुरस्कारका लागी कतिपटक मनोनयन मा परेका थिए? (तर उनले सो पुरस्कार एक चोटी पनि प्राप्त गरेनन),11 Times,7 Times,5 Times,9 Times,
Gautam Buddha का पिता Suddhodana कहाँ को राजा थिए?,Kapilvastu,Makawanpur,Rupandehi,Nawalparasi,
भानुभक्त को जन्म कहाँ भएको थियो ?,लम्जुङ्ग,तनहुँ,गोर्खा,कास्की,
मुगल साम्राज्य को स्थापना कसले गरेका हुन् ?,Samrat Gurgin Khan,Samrat Kublai Khan,Samrat Asoka,Nawab Mir Qasim,
गुरु नानकले कुन धार्मिक सम्प्रदायको स्थापना गरेका यिए ?,इस्लाम,जैन,शीख,क्रिस्चयन,
भिमसेन थापा कसका छोरा थिए ?,भक्ति थापा,अमरसिह थापा,भीमदत्त,कालु थापा,
नेपाल एकीकरण हुनु पूर्व कति वटा राज्यमा बिभक्त थियो ?,32,44,52,25,
"नेपाल अन्तरिक शासन विधान,२००७ कहिलेदेखि जारी भएको थियो ?",२००७ चैत्र १२,२००७ चैत्र २०,२००७ चैत्र २९,२००७ चैत्र १५,
"नेपालको अन्तरिम संबिधान ,२०६३ कस्तो कानुन हो ?",मूल कानुन,सारवान कानुन,एन कानुन,कुनै पनि होइन,
बालाजुको २१ धारा कसले बनाउन लगाएका थिए ?,तेज नरसिंह मल्ल,प्रताप मल्ल,रणजित मल्ल,जय प्रकाश मल्ल,
"जर्मन संसदले Angela Merkel लाई कतिऔ कार्यकालका लागी सन् 2013, December 17 मा लगातार Chancellor पदमा निर्बाचित गरेको हो ?",तेस्रो कार्यकाल,दोस्रो कार्यकाल,साँतौ कार्यकाल,पाँचौ कार्यकाल,
""" Purple Haze "" गाजा नेपालको कुन जिल्ला मा मात्र पाइने गर्छ ?",रसुवा,जुम्ला,दोलखा,सोलुखुम्बु,
नेपालको श्रम शक्तिमा कुन प्रकृतिको जन शक्तिको बाहुल्यता छ ?,अदक्ष तथा अर्धदक्ष,अर्धदक्ष,सबै उत्तर ठिक छन्,दक्ष,
क्यारेट शब्द कुन बस्तु संग प्रयोग हुन्छ ?,मोती,सुन,हिरा,चाँदी,
E = MC^2 सुत्रका जन्मदाता को हुन् ?,Galileo Galilei,Albert Einstein,Charles Babbage,Isaac Newton,
गोरखापत्रले कति भाषामा समाचार एवम लेख प्रकाशन गर्छ ? (Data of 2014 AD),25,30,15,20,
एक व्यक्ति बाट अर्को व्यक्तिमा सर्ने रोग लाई के भनिन्छ ?,दिर्घ रोग,चर्म रोग,कुनै पनी होइन,सरुवा रोग,
कुन ग्रुपको रगतलाई Universal Donar भनिन्छ?,A,B,O,AB,
Mid-Western Development Region मा पर्ने अञ्चल कुन हो ?,Koshi,Bheri,Seti,Narayani,
तल दिएको मध्य कुन जिल्ला मेची अञ्चलमा पर्दैन ?,Panchthar,Terhathum,Taplejung,Jhapa,
Tanahun जिल्लाको सदरमुकाम कुन हो ?,Damauli,Pokhara,Kusma,Besisahar,
Australia महादेशको सबै भन्दा अग्लो हिमाल कुन हो ?,Mount McKinley,Mount Kilimanjaro,Mount Aconcagua,Mount Kosciuszko,
Athens को पहिलो लिखित संबिधान ड्रेगाले कहिले जारी गरेका थिए ?,ई. पू. 627,ई. पू. 624,ई. पू. 623,ई. पू. 621,
ताजीया कुन धर्मालम्बीको पर्व हो ?,Biddhist,Hindu,Muslim,Christian,
Who was the first Editor of Gorkhapatra?,MotiKrishna Khanal,MotiKrishna Sharma,Gopal Shrestha,Shree Krishna Aryal,
महात्मा गान्धी को वास्तविक नाम के हो ?,मोहन दास विलास गान्धी,रामसरण दास गान्धी,मोहन दास करमचन्द गान्धी,हरिसरण विलास गान्धी,
झन्डाको प्रचलन कुन देश बाट सुरु भएको हो ?,China,Finland,United kingdom,Denmark,
हाल सम्म कति जना नेपाली ले VC प्राप्त गरेका छन्?,8,12,13,10,
लिबियाली शासक कर्णेल गधपिको हत्या कहिले भएको थियो ?,20 October 2011,23 October 2011,17 October 2011,24 October 2011,
नेपालमा सर्वप्रथम बजेट कहिले प्रस्तुत् भएको हो ?,वि.स्.२००८ माघ २१,वि.स्.२००८ बैसाख  २०,वि.स्.२००८ श्रावण १५,वि.स्.२००८ जेष्ठ १०,
हिन्दु देवी देवताहरुको वासस्थान भएको पर्वत भनेर कुन पर्वतलाई चिनिन्छ ?,संजीवनी पर्वत,सुमेरु पर्वत,कैलाश पर्वत,सोमेशोर पर्वत,
पुस्तकमा  राख्ने प्रचलनको सुरुवात कुन देशबाट भएको हो ?,बेलायत,America,France,Denmark,
अमेरिकी गृह यूद्ध को अन्त्य कहिले भएको थियो ?,1868 AD March 9,1860 AD April 21,1870 AD April 7,1865 AD April 9,
नेपाल सर्बप्रथम कुन देशसंग दैत्य सम्बनध कायम भएको थियो ?,भारत,चिन,रुस,सयुक्त अधिराज्य,
नेपाल को संबिधान - २०७२ कहिले जारी भएको हो ?,2072-Ashoj-1,2071-Ashoj-3,2072-Ashoj-3,2072-Ashoj-2,
कौटिल्यका अनुसार राज्यको सम्प्रभुता कसमा निहित हुन्छ ?,राजा,संसद,अमात्य,जनता,
Bisheshwar Prasad Koirala को देहवसन कहिले भएको हो ?,२०३९ श्रावण ५,२०३९ श्रावण ६,२०३९ श्रावण १०,२०३९ श्रावण ११,
नेपालको राजधानी नुवाकोट कुन राजाको पालामा सारिएको हो ?,Rajendra Bir Bikram Shah,King Rana Bahadur Shah,Girvan Yuddha Shah,Prithvi Narayan Shah,
Which is the largest bilateral donor to Nepal?,Japan,Qatar,Malaysia,Pakistan,
विश्वव्यपार संगठनको नवौं मन्त्रीस्तरीय सम्मेलन कहिले सम्पन्न भयो ? (Was Organized at Bali of Indonesia),2013 March 5 - 8,2013 Dec 3 - 6,2013 July 25 - 28,2013 June 15 - 18,
अनुराधा कोइरालाले चलाएको संस्थाको नाम के हो ?,माईति नेपाल,नेपाल महिला संघ,नेपाली घर,शान्ति नेपाल,
Who is the founder of Google?,Sergey Brin& Bill Gates,Larry Page & Sergey Brin,Mark Zuckerberg & Larry Page,Steve Jobs & Bill Gates,
सबै भन्दा ठुलो / लामो माछा कुन हो ?,Shark,Fin whale,Dolphin,Blue Whale,
"नेपाल को कुन ठाउँ मा ""Film City"" निर्माण गरिने भएको छ ?",Pokhara,Illam,Bandipur,Dolakha,
तलको कुन चाहिँ नदि कर्णाली नदीका सात सहायक नदीको समुहमा पर्दैन ?,हुम्ला कर्णाली,मुगु कर्णाली,ठुली भेरी,चमेलिया,
नेपालमा सरदर बार्षिक बर्षा कति हुन्छ ?,करिब २८० अर्ब घनमिटर,करिब २२५ अर्ब घनमिटर,करिब  १८० अर्ब घनमिटर,करिब २५० अर्ब घनमिटर,
मनसुनी जलवायु कुन कुराको परिवर्तनमा निर्भर गर्दछ ?,वायुको उचाई,वायुको चाप,वायुको दिशा,वायुको तापक्रम,
हिमाली प्रदेशले कुल क्षेत्रफलको कति प्रतिसत भूभाग ओगटेको छ ?,25%,15%,18%,22%,
Jumla जिल्लाको सदरमुकाम कुन हो ?,Jumla,Dunai,Manma,Gamgadi,
Syangja जिल्लाको सदरमुकाम कुन हो ?,Beni,Syangja,Damauli,Besisahar,
पृथ्वीलाई आफ्नो अक्षमा घुम्न कती समय लाग्छ ?,23 Hr 51 Min 55 Sec,24 Hr 02 Min 8 Sec,23 Hr 4 Min 12 Sec,23 Hr 56 Min 4 Sec,
ग्रिक सभ्यतामा राज्य लाई के भनिन्थ्यो?,पोलिस,नगर,राष्ट्र,राज्य,
पासांङ् ल्हामु शेर्पा नेपालको कति औ महिला राष्ट्रिय विभुती हुन् ?,पाचौ,दोस्रो,तेस्रो,पहिलो,
चाणक्य मौर्य सम्राट चन्द्र गुप्तको को थिए ?,चिकित्सक,सारथी,सेनापति,राजगुरु,
1748 AD मा प्रकासित The Spirit of the Laws का लेखक को हुन् ?,Socrates,Karl Marx,Aristotle,Montesquieu,
आभिर अधिनायक जिस्नु गुप्तदूवरामनोनित गरिएकोराजा को थिए ?,महिदेव,मनुदेव,धुर्बदेव,वरदेव,
नेपाल सरकारले निजामती सेवामा बदुवाका लागी वर्षमा दुई पटक बिज्ञापन गर्दछ। पहिलो असार महिना हो भने दोस्रो कुन हो ?,Poush,Kartik,Falgun,Magh,
चाणक्य को जन्म कहाँ भएको विश्वास गरिन्छ ?,तत्कालिन भारत को गुजरात,तत्कालिन भारत को तक्षसिला,तत्कालिन भारत को बिहार,तत्कालिन भारत को केरेला,
नागरिक बडापत्र कुन मूल सिद्धान्तमा आधारित छ ?,जनताको सर्बभौमसत्ताको सिद्धान्त,Social Mobilizatoin theory,Theory of transparency,Political theory,
कौटिल्य को अर्थशास्त्रको अनुसार राजामा कती प्रकारका मानविय गुण हरु हुनु पर्दछ ?,19,25,53,48,
नेपालमा कुल भूमिको कति प्रतिसत भूभाग खेतीयोग्य जमिन रहेको छ ?,करिब १२ %,करिब १७ %,करिब २२ %,करिब ३२ %,
कुन ग्रुपको रगत स्थान्तरण गर्न सबैभन्दा सुरक्षित हुन्छ ?,0 N,A 'P',B 'N',AB 'P',
Rukum जिल्लाको सदरमुकाम कुन हो ?,Liwang,Pyuthan Khalanga,Ghorahi,Musikot,
सौर्यमण्डलमा कती प्रतिसत स्थान सुर्यले ओगटेको छ ?,18.2%,12.5%,11.8%,15.0%,
धातु बाट नामकरण गरिएको देश कुन हो ?,Argentina,Mali,Russia,Turkey,
Taplejung जिल्लाको सदरमुकाम कुन हो ?,Fidim,Chandragadi,Illam,Taplejung,
तल दिएको मध्ये Western Development Region मा नपर्ने जिल्ला कुन हो ?,Rupandehi,Syangja,Dang,Parbat,
फुंङ्चु  कुन नदीको अर्को नाउ हो ?,Tamor,Likhu,Arun,Tamakoshi,
विश्वको एक कलात्मक सुन्दर सहर कुन हो ?,"London, England","Tokyo, Japan","Cairo, Egypt","Paris, France",
शाहबंसिय राजाहरुमा सबै भन्दा बुढो उमेरमा मा राजा हुने को हुन् ?,King Gyanendra,King Rana Bahadur,King Surendra,King Rajendra,
St. Peter Church of Rome कसले बनाएका हुन् ?,डेबिड हक,माईकल अब्रहीम,माईकल एंजोल,Leonardo Da Vinci,
"""हिटलर र यहुदी""  कृतिका लेखक को हुन् ?",बिजयबहादुर मल्ल,गोपालप्रसाद रिमाल,सुबास घिसीङ्,वि.पी. कोइराला,
